{
  "schemaVersion": "1.0",
  "id": "official.monochrome.light-high-contrast",
  "name": "Monochrome Light High Contrast",
  "author": "Prodivix",
  "source": "official",
  "mode": "light",
  "semantic": {
    "surface": {
      "canvas": "{palette.gray.0}",
      "panel": "{palette.gray.0}",
      "raised": "{palette.gray.0}"
    },
    "text": {
      "primary": "{palette.gray.13}",
      "secondary": "{palette.gray.13}",
      "muted": "{palette.gray.11}",
      "inverse": "{palette.gray.0}"
    },
    "border": {
      "subtle": "{palette.gray.13}",
      "default": "{palette.gray.13}",
      "strong": "{palette.gray.13}"
    },
    "accent": {
      "default": "{palette.gray.13}",
      "hover": "{palette.gray.11}"
    },
    "success": {
      "default": "{palette.green.11}",
      "hover": "{palette.green.13}",
      "subtle": "{palette.green.2}",
      "subtleHover": "{palette.green.3}"
    },
    "danger": {
      "default": "{palette.red.11}",
      "hover": "{palette.red.13}",
      "subtle": "{palette.red.2}",
      "subtleHover": "{palette.red.3}"
    },
    "warning": {
      "default": "{palette.yellow.11}",
      "hover": "{palette.yellow.13}",
      "subtle": "{palette.yellow.2}",
      "subtleHover": "{palette.yellow.3}"
    },
    "info": {
      "default": "{palette.blue.11}",
      "hover": "{palette.blue.13}",
      "subtle": "{palette.blue.2}",
      "subtleHover": "{palette.blue.3}"
    }
  },
  "product": {
    "editor": {
      "canvasBackground": "{semantic.surface.canvas}",
      "selectionOutline": "{semantic.accent.default}",
      "dropIndicator": "{semantic.accent.default}"
    },
    "editorBar": {
      "background": "{palette.gray.13}",
      "icon": "{palette.gray.0}",
      "iconHover": "{palette.gray.0}",
      "iconHoverBackground": "rgb(255 255 255 / 0.18)"
    },
    "inspector": {
      "rowHover": "{palette.gray.3}",
      "fieldLabel": "{semantic.text.primary}",
      "fieldControl": "{semantic.text.primary}"
    },
    "nodeGraph": {
      "nodeBackground": "{semantic.surface.panel}",
      "nodeBorder": "{semantic.border.strong}",
      "portColor": "{semantic.text.primary}"
    },
    "home": {
      "logo": "{palette.gray.13}",
      "heroText": "{palette.gray.13}",
      "heroHighlight": "{palette.gray.13}",
      "subtitle": "{palette.gray.11}",
      "navIcon": "{palette.gray.13}",
      "navIconHoverBg": "{palette.gray.3}",
      "navIconHoverText": "{palette.gray.13}",
      "profileBg": "{palette.gray.0}",
      "profileHoverShadow": "0 0 0 2px rgb(0 0 0 / 1)",
      "footerText": "{palette.gray.13}"
    }
  },
  "typography": {
    "fontSize": {
      "micro": "10px",
      "caption": "11px",
      "2xs": "10px",
      "xs": "12px",
      "sm": "13px",
      "md": "14px",
      "lg": "16px",
      "xl": "18px",
      "2xl": "20px",
      "3xl": "24px",
      "4xl": "30px",
      "5xl": "36px",
      "hero": "64px"
    },
    "fontWeight": {
      "regular": "500",
      "medium": "600",
      "semibold": "700",
      "bold": "800",
      "extrabold": "900"
    },
    "lineHeight": {
      "tight": "1",
      "compact": "1.3",
      "editor": "1.45",
      "normal": "1.5"
    }
  },
  "radius": {
    "none": "0",
    "sm": "4px",
    "md": "8px",
    "lg": "12px",
    "full": "9999px"
  },
  "shadow": {
    "sm": "0 0 0 1px rgb(0 0 0 / 1)",
    "md": "0 0 0 2px rgb(0 0 0 / 1)",
    "lg": "0 0 0 3px rgb(0 0 0 / 1)"
  },
  "density": {
    "spacing": {
      "none": "0",
      "xs": "4px",
      "sm": "8px",
      "md": "16px",
      "lg": "24px",
      "xl": "32px",
      "2xl": "48px"
    },
    "controlHeight": {
      "sm": "24px",
      "md": "28px",
      "lg": "32px"
    }
  },
  "motion": {
    "duration": {
      "fast": "150ms",
      "normal": "300ms"
    },
    "easing": {
      "standard": "ease"
    }
  },
  "metadata": {
    "description": "High contrast light theme with maximum text and border contrast for accessibility.",
    "tags": ["official", "monochrome", "light", "high-contrast", "a11y"],
    "license": "MIT"
  }
}
